{
  "$schema": "https://json-schema.org/draft/2020-12/schema",
  "$id": "urn:mdplace:schema:codex-adapter-claim-manifest:v1",
  "title": "mdplace Codex isolated claim",
  "type": "object",
  "additionalProperties": false,
  "required": [
    "$schema",
    "schema_id",
    "manifest_id",
    "package_series",
    "release_version",
    "validator_id",
    "validator_version",
    "rows"
  ],
  "properties": {
    "$schema": {
      "const": "../schemas/codex-adapter-claim-manifest.schema.json"
    },
    "schema_id": {
      "const": "mdplace.codex-adapter-claim-manifest/v1"
    },
    "manifest_id": {
      "const": "codex-adapter-claim:v1"
    },
    "package_series": {
      "const": "mdplace-spec/v1"
    },
    "release_version": {
      "const": "1.0.0"
    },
    "validator_id": {
      "const": "mdplace.package-validator"
    },
    "validator_version": {
      "const": "1.2.0"
    },
    "rows": {
      "type": "array",
      "minItems": 1,
      "maxItems": 1,
      "items": {
        "$ref": "#/$defs/row"
      }
    }
  },
  "$defs": {
    "material": {
      "type": "object",
      "additionalProperties": false,
      "required": [
        "ordinal",
        "label",
        "path",
        "sha256"
      ],
      "properties": {
        "ordinal": {
          "type": "integer",
          "minimum": 0
        },
        "label": {
          "type": "string",
          "pattern": "^codex_material_[0-9]{3}$"
        },
        "path": {
          "type": "string",
          "minLength": 1
        },
        "sha256": {
          "type": "string",
          "pattern": "^[a-f0-9]{64}$"
        }
      }
    },
    "dependencies": {
      "type": "object",
      "additionalProperties": false,
      "required": [
        "core",
        "product_readiness",
        "local_adapter",
        "remote_adapter",
        "placement_automation",
        "other_profiles"
      ],
      "properties": {
        "core": {
          "const": false
        },
        "product_readiness": {
          "const": false
        },
        "local_adapter": {
          "const": false
        },
        "remote_adapter": {
          "const": false
        },
        "placement_automation": {
          "const": false
        },
        "other_profiles": {
          "const": false
        }
      }
    },
    "row": {
      "type": "object",
      "additionalProperties": false,
      "required": [
        "id",
        "owner",
        "verdict",
        "evidence_digest",
        "evidence_material",
        "dependencies_elevated"
      ],
      "properties": {
        "id": {
          "const": "codex-adapter"
        },
        "owner": {
          "const": "codex-adapter"
        },
        "verdict": {
          "enum": [
            "pass",
            "fail",
            "unsupported",
            "inconclusive"
          ]
        },
        "evidence_digest": {
          "type": "string",
          "pattern": "^[a-f0-9]{64}$"
        },
        "evidence_material": {
          "type": "array",
          "minItems": 1,
          "items": {
            "$ref": "#/$defs/material"
          }
        },
        "dependencies_elevated": {
          "$ref": "#/$defs/dependencies"
        }
      }
    }
  }
}
