{
  "$schema": "../schemas/codex-adapter-claim-manifest.schema.json",
  "schema_id": "mdplace.codex-adapter-claim-manifest/v1",
  "manifest_id": "codex-adapter-claim:v1",
  "package_series": "mdplace-spec/v1",
  "release_version": "1.0.0",
  "validator_id": "mdplace.package-validator",
  "validator_version": "1.2.0",
  "rows": [
    {
      "id": "codex-adapter",
      "owner": "codex-adapter",
      "verdict": "pass",
      "evidence_digest": "3ae60c035974e78bd1b37e1811a350112e69c4afcb12cbfb430ebc81764b1599",
      "evidence_material": [
        {
          "ordinal": 0,
          "label": "codex_material_001",
          "path": "normative/codex-intelligence-adapter-profile.md",
          "sha256": "92beea18078105b17c9d50fa8ab2568cc556b84d9c39a825227b36f6aef1da63"
        },
        {
          "ordinal": 1,
          "label": "codex_material_002",
          "path": "contracts/codex-intelligence-adapter/profile.json",
          "sha256": "5fe6130f3807b3d75a03ae9f4dff002bd55b904a6ea5924f7f94c946af76fe98"
        },
        {
          "ordinal": 2,
          "label": "codex_material_003",
          "path": "contracts/codex-intelligence-adapter/boundary.json",
          "sha256": "ebd492711cb60b22e316d2703d2c22d928ceb63d49022582b1aa2398a5911dc7"
        },
        {
          "ordinal": 3,
          "label": "codex_material_004",
          "path": "contracts/codex-intelligence-adapter/authentication-prerequisite.json",
          "sha256": "34694252b7eaa71d3da78bcf9447370766b53397a48a20f1159938005938c2b9"
        },
        {
          "ordinal": 4,
          "label": "codex_material_005",
          "path": "contracts/codex-intelligence-adapter/capability-proof.json",
          "sha256": "71923d793b2a081a3349ac74f8049863d482dfbcf853b73a978b8e5bb4387e44"
        },
        {
          "ordinal": 5,
          "label": "codex_material_006",
          "path": "contracts/codex-intelligence-adapter/network-proof.json",
          "sha256": "1bba1d77be7e50e44c3503c8aac0384e1fbcc004a62df8ba8bd6ad6ea2400445"
        },
        {
          "ordinal": 6,
          "label": "codex_material_007",
          "path": "contracts/codex-intelligence-adapter/fixture-manifest.json",
          "sha256": "cfab1bab2c269080a2b01a2bf6dc22d18b5fb488d04d429fdf3838f7970070dd"
        },
        {
          "ordinal": 7,
          "label": "codex_material_008",
          "path": "contracts/verdicts/codex-adapter-verdicts.json",
          "sha256": "e75dd7a90b75d42aeed5e1e74be874a45b30caf0c62e49103cb046282599804c"
        },
        {
          "ordinal": 8,
          "label": "codex_material_009",
          "path": "conformance/evidence/codex-adapter-evidence.json",
          "sha256": "228146d632c7fc19b1788f72a2257f970b7653c81489b6dcfa05b7dd14969c5e"
        },
        {
          "ordinal": 9,
          "label": "codex_material_010",
          "path": "conformance/scenarios/codex-intelligence-adapter/valid-noninteractive-proposal.json",
          "sha256": "5def53afef1619ffcb767ad6b468cfc283ddad0e956b8503be4852f1972290bf"
        },
        {
          "ordinal": 10,
          "label": "codex_material_011",
          "path": "conformance/scenarios/codex-intelligence-adapter/valid-abstention-remains-advice.json",
          "sha256": "5eb67197e57be57510a8e211c10ba1ba57e6032f18174809b7337f3ec1fafa8c"
        },
        {
          "ordinal": 11,
          "label": "codex_material_012",
          "path": "conformance/scenarios/codex-intelligence-adapter/hostile-input-remains-inert.json",
          "sha256": "03a86ec90a010aa828bbce092b39b399ed9e3911da3ae42c6ae7a10e2c694fc7"
        },
        {
          "ordinal": 12,
          "label": "codex_material_013",
          "path": "conformance/scenarios/codex-intelligence-adapter/exact-input-ceiling.json",
          "sha256": "1de7fe4ab0cdbc8e803f4d91054c295b43ad452ebae7b63268d0b2651248f150"
        },
        {
          "ordinal": 13,
          "label": "codex_material_014",
          "path": "conformance/scenarios/codex-intelligence-adapter/exact-jsonl-ceiling.json",
          "sha256": "ac0de52b6cdcb3f22d50993cfbc823c70d1732b0060071dcb30701d53ebb604c"
        },
        {
          "ordinal": 14,
          "label": "codex_material_015",
          "path": "conformance/scenarios/codex-intelligence-adapter/exact-output-ceiling.json",
          "sha256": "acbb87c9dda0aade2e494a2e46ce1423e4fc53c43aa2a24557bca5dbb60f8585"
        },
        {
          "ordinal": 15,
          "label": "codex_material_016",
          "path": "conformance/scenarios/codex-intelligence-adapter/exact-runtime-ceiling.json",
          "sha256": "dcc921d6e35cc47a0a7c0a5ea39a018001c967e04123f59887a6517278560691"
        },
        {
          "ordinal": 16,
          "label": "codex_material_017",
          "path": "conformance/scenarios/codex-intelligence-adapter/exact-token-ceiling.json",
          "sha256": "f1646afd47ed034ecc7b000307e75a4a3b13b0c5b13830744d59d77de64b59d5"
        },
        {
          "ordinal": 17,
          "label": "codex_material_018",
          "path": "conformance/scenarios/codex-intelligence-adapter/exact-cost-ceiling.json",
          "sha256": "65592df76e3d3035af67d032f31cc5511db335faa9fe423be4e21d9337456577"
        },
        {
          "ordinal": 18,
          "label": "codex_material_019",
          "path": "conformance/scenarios/codex-intelligence-adapter/input-limit-exceeded.json",
          "sha256": "1ec844c84166c47e541583f3575418dbd86abab8afabbf621aa6327eb5d01729"
        },
        {
          "ordinal": 19,
          "label": "codex_material_020",
          "path": "conformance/scenarios/codex-intelligence-adapter/jsonl-limit-exceeded.json",
          "sha256": "70d7ad5d75d0d8dcf9a2a5f644e5fadd3ae453eec60695a7e9dadc7b6f7bd9a7"
        },
        {
          "ordinal": 20,
          "label": "codex_material_021",
          "path": "conformance/scenarios/codex-intelligence-adapter/output-limit-exceeded.json",
          "sha256": "e11882416b77d5eb2e8290a65bac8d2694ad886737da789b6fac78834963ce1d"
        },
        {
          "ordinal": 21,
          "label": "codex_material_022",
          "path": "conformance/scenarios/codex-intelligence-adapter/runtime-limit-exceeded.json",
          "sha256": "3326b1b3d4e3389f169ba61fb3f9bce4bcf5fae31d23be8a7542941cefc35b26"
        },
        {
          "ordinal": 22,
          "label": "codex_material_023",
          "path": "conformance/scenarios/codex-intelligence-adapter/token-limit-exceeded.json",
          "sha256": "ffe191341e1dc61527a292c12ba67788350bf795b89d98ee3df19042e12c3955"
        },
        {
          "ordinal": 23,
          "label": "codex_material_024",
          "path": "conformance/scenarios/codex-intelligence-adapter/cost-limit-exceeded.json",
          "sha256": "dd4df3205a555a049fb2d05974bc43cd00b3ece124412a987b95e7ed043744ee"
        },
        {
          "ordinal": 24,
          "label": "codex_material_025",
          "path": "conformance/scenarios/codex-intelligence-adapter/interactive-only-execution-denied.json",
          "sha256": "987466ef1279fde0c7f4c34c1544584c1d48461496339b0c71b5015dc1ef1fb9"
        },
        {
          "ordinal": 25,
          "label": "codex_material_026",
          "path": "conformance/scenarios/codex-intelligence-adapter/missing-boundary-denied.json",
          "sha256": "7914a6a751bd1c4959c967913a662f56c375b233079b3a02258c2fd421c9603f"
        },
        {
          "ordinal": 26,
          "label": "codex_material_027",
          "path": "conformance/scenarios/codex-intelligence-adapter/stale-binding-denied.json",
          "sha256": "3acd74aa653a226176db267a3bead8251160b6c99c0d13b0d6b934be8a67a683"
        },
        {
          "ordinal": 27,
          "label": "codex_material_028",
          "path": "conformance/scenarios/codex-intelligence-adapter/missing-authentication-prerequisite-denied.json",
          "sha256": "f77aa5542b91e7f637cbaad93343691335113a774fd449b78c8001a564470ccd"
        },
        {
          "ordinal": 28,
          "label": "codex_material_029",
          "path": "conformance/scenarios/codex-intelligence-adapter/stale-authentication-prerequisite-denied.json",
          "sha256": "d4c55f47f26bdc4133d498e93fc48c51e6e75fb2f1c4e38ea0fef973d2536952"
        },
        {
          "ordinal": 29,
          "label": "codex_material_030",
          "path": "conformance/scenarios/codex-intelligence-adapter/unsupported-authentication-prerequisite-denied.json",
          "sha256": "2acf4ca95051b1fa6bed91d9cd9c4ac1ab8eb9b3ced49e41e1bf2405ef3ea4d8"
        },
        {
          "ordinal": 30,
          "label": "codex_material_031",
          "path": "conformance/scenarios/codex-intelligence-adapter/inconclusive-authentication-prerequisite-denied.json",
          "sha256": "cde2d38647943bf56c25e351349e014f460e35b8c54c45fbf720906877c71f73"
        },
        {
          "ordinal": 31,
          "label": "codex_material_032",
          "path": "conformance/scenarios/codex-intelligence-adapter/failed-authentication-prerequisite-denied.json",
          "sha256": "219d42f5533c443b9929db5249be624a5c376964be1afd249a983214d685075a"
        },
        {
          "ordinal": 32,
          "label": "codex_material_033",
          "path": "conformance/scenarios/codex-intelligence-adapter/missing-capability-proof-denied.json",
          "sha256": "51e50ed3d93510125a37f4e6ead716b4a3ad903288c29c76d0ee8aef9db2ec14"
        },
        {
          "ordinal": 33,
          "label": "codex_material_034",
          "path": "conformance/scenarios/codex-intelligence-adapter/stale-capability-proof-denied.json",
          "sha256": "f899dfeafd5e2c8babc381ea8dbb2e2a706dabb932d550ade8ec53a45e64b3b0"
        },
        {
          "ordinal": 34,
          "label": "codex_material_035",
          "path": "conformance/scenarios/codex-intelligence-adapter/ambiguous-capability-proof-denied.json",
          "sha256": "0f2213753fb91ae42593d4e12a503d5f57c3163f2d50c5eb726d425d972564d9"
        },
        {